number,value,datetime_start,datetime_complete,duration,params_activation,params_batch_size,params_dropout,params_epochs,params_lr,params_n_layers,params_n_units_l1,params_n_units_l2,params_n_units_l3,params_optimizer,params_optimizer_secondary,params_pca_n_components,params_weight_decay,state
0,0.28756010370371954,2026-08-03 20:21:05.872957,2026-08-03 20:22:39.870828,0 days 00:01:33.997871,silu,512,0.06445513590897933,56,0.00024078921495774262,3,54,90.0,243.0,adam,adamw,42,0.004637927511192855,COMPLETE
1,0.3129342514350202,2026-08-03 20:22:39.875554,2026-08-03 20:24:20.751734,0 days 00:01:40.876180,gelu,256,0.4926504096429939,145,0.00031438072231661284,1,190,,,rmsprop,adamw,35,0.0008017781625046902,COMPLETE
2,0.28092237777552864,2026-08-03 20:24:20.756162,2026-08-03 20:26:02.361788,0 days 00:01:41.605626,leaky_relu,256,0.04042424656712901,281,0.007580436014494162,2,84,233.0,,rmsprop,adamw,12,2.5311463467000393e-06,COMPLETE
3,0.3050542155653665,2026-08-03 20:26:02.366379,2026-08-03 20:38:34.693553,0 days 00:12:32.327174,gelu,32,0.07059716172857039,500,0.0003844212265672901,3,192,139.0,77.0,rmsprop,adam,14,2.3856863423788525e-06,COMPLETE
4,0.11592965689139183,2026-08-03 20:38:34.698154,2026-08-03 20:39:51.829699,0 days 00:01:17.131545,gelu,256,0.21315121340513693,377,0.0006148112126966289,3,49,239.0,189.0,sgd,sgd,16,0.002063447622306043,COMPLETE
5,0.22163020984096074,2026-08-03 20:39:51.834316,2026-08-03 20:41:32.545091,0 days 00:01:40.710775,leaky_relu,256,0.03566089566290104,347,0.008839515441888513,1,199,,,rmsprop,rmsprop,9,1.2115261767215902e-06,COMPLETE
6,0.25824755583643827,2026-08-03 20:41:32.549572,2026-08-03 20:43:16.197281,0 days 00:01:43.647709,leaky_relu,256,0.18147844415798037,153,0.005014313831516225,2,63,248.0,,rmsprop,rmsprop,34,0.0016441716584827929,COMPLETE
7,0.1685295791313171,2026-08-03 20:43:16.201869,2026-08-03 20:44:32.789243,0 days 00:01:16.587374,silu,512,0.3426308938572794,369,0.0003102001994608345,2,47,165.0,,sgd,rmsprop,7,0.0010071148570029139,COMPLETE
8,0.3071186836297234,2026-08-03 20:44:32.793776,2026-08-03 20:46:06.968733,0 days 00:01:34.174957,silu,512,0.16830194674396048,82,0.0015936180698831236,2,108,243.0,,rmsprop,adam,41,2.387291497285918e-05,COMPLETE
9,0.31585909228574266,2026-08-03 20:46:06.973302,2026-08-03 20:47:51.880669,0 days 00:01:44.907367,leaky_relu,512,0.3793205819225181,106,0.000781520236547653,3,183,32.0,166.0,adam,rmsprop,28,0.0003122018128580877,COMPLETE
10,0.3102351413384087,2026-08-03 20:47:51.885477,2026-08-03 20:50:02.840592,0 days 00:02:10.955115,leaky_relu,128,0.362487097855603,202,0.0024044985723334863,3,235,32.0,122.0,adam,sgd,25,9.060854932219897e-05,COMPLETE
11,0.31822537800795536,2026-08-03 20:50:02.845374,2026-08-03 20:53:48.898581,0 days 00:03:46.053207,gelu,64,0.48890391225361063,158,0.00011088815464572117,1,153,,,adamw,adamw,29,0.0003246433784284775,COMPLETE
12,0.3186003603580327,2026-08-03 20:53:48.903952,2026-08-03 20:56:46.482333,0 days 00:02:57.578381,gelu,64,0.485285142550169,214,0.0001064231965561286,1,140,,,adamw,adamw,24,0.00020328087175656986,COMPLETE
13,0.31660663520338195,2026-08-03 20:56:46.487078,2026-08-03 20:59:31.847200,0 days 00:02:45.360122,gelu,64,0.4932206919614251,222,0.00010775285366052018,1,131,,,adamw,adamw,21,4.8728383194832e-05,COMPLETE
14,0.32056340747611717,2026-08-03 20:59:31.851899,2026-08-03 21:02:37.997610,0 days 00:03:06.145711,gelu,64,0.42632338860544383,266,0.00010587961943778844,1,149,,,adamw,adamw,29,0.000212708708630087,COMPLETE
15,0.30992536302063645,2026-08-03 21:02:38.002331,2026-08-03 21:05:59.003185,0 days 00:03:21.000854,gelu,64,0.4000963668215441,291,0.0001739816426062082,1,148,,,adamw,adamw,21,1.1355888765175874e-05,COMPLETE
16,0.3160140459851729,2026-08-03 21:05:59.007608,2026-08-03 21:10:16.248450,0 days 00:04:17.240842,gelu,64,0.2898338844087528,232,0.0001675925522232325,1,116,,,adamw,adamw,36,0.00024188246847341497,COMPLETE
17,0.3084577251178649,2026-08-03 21:10:16.253296,2026-08-03 21:13:24.618123,0 days 00:03:08.364827,gelu,64,0.4308321397409977,321,0.0005381753115486909,1,160,,,adamw,adamw,19,1.0574946170640757e-05,COMPLETE
18,0.30706750690459944,2026-08-03 21:13:24.622980,2026-08-03 21:16:27.147366,0 days 00:03:02.524386,gelu,128,0.30349030628506923,428,0.0016523147224187704,2,232,185.0,,adamw,sgd,31,0.00012833787394492277,COMPLETE
19,0.3222829611857813,2026-08-03 21:16:27.153004,2026-08-03 21:21:41.158342,0 days 00:05:14.005338,gelu,32,0.42623945835394433,255,0.00018179140495964998,1,100,,,adamw,adam,25,5.3680589943834026e-05,COMPLETE
20,0.3227344545395849,2026-08-03 21:21:41.168021,2026-08-03 21:28:24.421134,0 days 00:06:43.253113,silu,32,0.4273476743823523,262,0.0001918757358008043,1,91,,,adamw,adam,38,4.154606353418138e-05,COMPLETE
21,0.3317288422701786,2026-08-03 21:28:24.429806,2026-08-03 21:32:56.054864,0 days 00:04:31.625058,silu,32,0.43414436764131803,266,0.00018161143053071693,1,87,,,adamw,adam,38,3.377169250006518e-05,COMPLETE
22,0.3261523092600068,2026-08-03 21:32:56.060943,2026-08-03 21:38:21.415291,0 days 00:05:25.354348,silu,32,0.4442903835069987,253,0.00019711319543452193,1,87,,,adamw,adam,39,4.534611872522722e-05,COMPLETE
23,0.323174476939208,2026-08-03 21:38:21.420746,2026-08-03 21:45:10.713927,0 days 00:06:49.293181,silu,32,0.32153320035358063,314,0.00020617448153623677,1,77,,,adamw,adam,39,1.621763409535188e-05,COMPLETE
24,0.2959841233464845,2026-08-03 21:45:10.721476,2026-08-03 21:50:52.742027,0 days 00:05:42.020551,silu,32,0.2725175316729368,326,0.00041774314837259686,2,74,98.0,,sgd,adam,44,1.1248460106790891e-05,COMPLETE
25,0.32136837350383385,2026-08-03 21:50:52.747450,2026-08-03 21:56:26.153840,0 days 00:05:33.406390,silu,32,0.3260257519285112,410,0.00027127690968281604,1,34,,,adamw,adam,40,5.377142656819757e-06,COMPLETE
26,0.30471248117265654,2026-08-03 21:56:26.159563,2026-08-03 21:59:01.389951,0 days 00:02:35.230388,silu,32,0.4530301805756131,306,0.0010995079761719614,2,75,199.0,,adamw,adam,3,2.1279031909031597e-05,COMPLETE
27,0.31382307868699555,2026-08-03 21:59:01.395272,2026-08-03 22:04:42.122889,0 days 00:05:40.727617,silu,32,0.23735740787725124,418,0.000462050111277675,1,121,,,adamw,adam,44,7.096824573451832e-05,COMPLETE
28,0.33315170000654826,2026-08-03 22:04:42.128948,2026-08-03 22:08:57.890608,0 days 00:04:15.761660,silu,32,0.38913462939417753,464,0.00014808251549736372,1,32,,,adamw,adam,38,2.4909030880901235e-05,COMPLETE
29,0.32419097842430256,2026-08-03 22:08:57.897165,2026-08-03 22:12:24.628350,0 days 00:03:26.731185,silu,32,0.36955364286479336,463,0.00015580407745181387,2,34,109.0,,adam,adam,33,0.008157326622212923,COMPLETE
30,0.31304529049476904,2026-08-03 22:12:24.633689,2026-08-03 22:16:04.568331,0 days 00:03:39.934642,silu,32,0.40207619474413986,382,0.00024926974397506573,1,54,,,sgd,adam,37,6.823949820028416e-06,COMPLETE
31,0.3219982320382753,2026-08-03 22:16:04.573752,2026-08-03 22:20:07.702289,0 days 00:04:03.128537,silu,32,0.37930299201081163,493,0.00015316174720244333,2,34,100.0,,adam,adam,32,0.006978839852987341,COMPLETE
32,0.33015980109907483,2026-08-03 22:20:07.708747,2026-08-03 22:24:39.269339,0 days 00:04:31.560592,silu,32,0.45834431863083847,466,0.0001337250767929658,2,63,134.0,,adam,adam,34,3.389884953893034e-05,COMPLETE
33,0.33053991571725067,2026-08-03 22:24:39.275028,2026-08-03 22:29:26.582600,0 days 00:04:47.307572,silu,32,0.45716372215732354,455,0.00013767578049660043,1,63,,,adam,adam,42,2.8463304052582247e-05,COMPLETE
34,0.3231762842473864,2026-08-03 22:29:26.589396,2026-08-03 22:33:52.963293,0 days 00:04:26.373897,silu,32,0.46406110605829726,434,0.0001369422351943612,2,62,136.0,,adam,adam,43,2.6831903277482215e-05,COMPLETE
35,0.31584595363998924,2026-08-03 22:33:52.969849,2026-08-03 22:35:57.705451,0 days 00:02:04.735602,silu,128,0.4734877874960668,469,0.0003395075133455684,1,62,,,adam,adam,45,4.277633431145011e-06,COMPLETE
36,0.3267096559353969,2026-08-03 22:35:57.710979,2026-08-03 22:41:25.195378,0 days 00:05:27.484399,silu,32,0.40511457209795687,463,0.0002456438997051091,3,45,65.0,37.0,adam,adam,36,0.0001349718587512085,COMPLETE
37,0.31790923910101665,2026-08-03 22:41:25.200648,2026-08-03 22:49:24.508188,0 days 00:07:59.307540,silu,32,0.08366472111468082,399,0.00012419214834654934,1,99,,,adam,sgd,42,2.822548186864649e-06,COMPLETE
38,0.3023075694079908,2026-08-03 22:49:24.514990,2026-08-03 22:51:10.328786,0 days 00:01:45.813796,silu,256,0.4584474156589724,351,0.00032042534300527544,2,66,205.0,,adam,adam,35,3.027772922259538e-05,COMPLETE
39,0.31616370103276437,2026-08-03 22:51:10.336657,2026-08-03 22:54:55.275595,0 days 00:03:44.938938,silu,32,0.3509509715287713,494,0.004043156804173709,1,46,,,adam,adam,41,1.569138253174858e-05,COMPLETE
40,0.32051445449876065,2026-08-03 22:54:55.285739,2026-08-03 22:57:03.366801,0 days 00:02:08.081062,leaky_relu,512,0.12057760002347306,445,0.0006831939845488604,3,54,163.0,240.0,rmsprop,rmsprop,34,7.5529378463123345e-06,COMPLETE
41,0.31635397929745757,2026-08-03 22:57:03.372927,2026-08-03 23:03:59.905486,0 days 00:06:56.532559,silu,32,0.38976845694751255,470,0.00022656227501254562,3,43,62.0,39.0,adam,adam,37,0.00011176262063141233,COMPLETE
42,0.3232509487245544,2026-08-03 23:03:59.916810,2026-08-03 23:09:39.812822,0 days 00:05:39.896012,silu,32,0.4090618581963056,449,0.00013709499004654663,3,69,67.0,32.0,adam,adam,36,0.0005504952004450818,COMPLETE
43,0.3205217106452133,2026-08-03 23:09:39.821754,2026-08-03 23:15:20.478148,0 days 00:05:40.656394,silu,32,0.4976932591667307,479,0.00024330466912496855,3,55,127.0,110.0,adam,adam,41,0.0001384905923562649,COMPLETE
44,0.3076426013164644,2026-08-03 23:15:20.485480,2026-08-03 23:17:27.108419,0 days 00:02:06.622939,silu,256,0.013239109650655861,385,0.00028331848095377953,2,84,59.0,,adam,adam,31,7.66738027003797e-05,COMPLETE
45,0.16049910682621243,2026-08-03 23:17:27.116764,2026-08-03 23:21:44.025692,0 days 00:04:16.908928,silu,32,0.44118734249115493,179,0.0001341090076343264,3,39,119.0,75.0,sgd,rmsprop,38,1.009358349884496e-06,COMPLETE
46,0.2820766199946703,2026-08-03 23:21:44.029291,2026-08-03 23:22:53.564976,0 days 00:01:09.535685,leaky_relu,512,0.46847225893101063,450,0.00010073276996056797,2,48,79.0,,rmsprop,sgd,28,3.5528310935644544e-05,COMPLETE
47,0.3100261182040809,2026-08-03 23:22:53.567661,2026-08-03 23:24:38.604699,0 days 00:01:45.037038,silu,128,0.3505018330128858,359,0.00035546783733225295,1,97,,,adam,adam,34,0.0004974816307438312,COMPLETE
48,0.31943977816784425,2026-08-03 23:24:38.607306,2026-08-03 23:29:01.418610,0 days 00:04:22.811304,silu,32,0.41051976703013693,398,0.00021405550120989845,3,59,163.0,193.0,adam,adam,42,6.183382733892881e-05,COMPLETE
49,0.31042977553720263,2026-08-03 23:29:01.423192,2026-08-03 23:32:47.085706,0 days 00:03:45.662514,leaky_relu,32,0.19967326774415964,498,0.0009029110912052126,2,250,50.0,,adam,adam,40,1.701705467562645e-05,COMPLETE
50,0.3070148180044781,2026-08-03 23:32:47.089513,2026-08-03 23:34:10.059736,0 days 00:01:22.970223,silu,256,0.4103213601592066,417,0.0001283208467470237,1,79,,,rmsprop,rmsprop,45,0.00015568719524447884,COMPLETE
51,0.335844323030212,2026-08-03 23:34:10.063069,2026-08-03 23:36:10.286699,0 days 00:02:00.223630,silu,32,0.44616044307555414,50,0.0001665971621261463,1,87,,,adamw,adam,39,4.014649988934246e-05,COMPLETE
52,0.3331635483827078,2026-08-03 23:36:10.289755,2026-08-03 23:38:25.406478,0 days 00:02:15.116723,silu,32,0.4824837517838251,71,0.0001560582906050622,1,172,,,adamw,adam,36,9.018950061397254e-05,COMPLETE
53,0.3339959468111398,2026-08-03 23:38:25.409205,2026-08-03 23:40:30.847667,0 days 00:02:05.438462,silu,32,0.4788596737669849,56,0.00016427412923776698,1,171,,,adamw,adam,39,2.3258973157111823e-05,COMPLETE
54,0.33826771796659316,2026-08-03 23:40:30.850433,2026-08-03 23:42:48.429361,0 days 00:02:17.578928,silu,32,0.4812683017693329,72,0.00016414607249343858,1,185,,,adamw,adam,38,2.2861128676700995e-05,COMPLETE
55,0.3362529842656653,2026-08-03 23:42:48.432113,2026-08-03 23:44:53.625449,0 days 00:02:05.193336,silu,32,0.4781209621420379,55,0.00017360549322527628,1,171,,,adamw,sgd,39,2.189693728982773e-05,COMPLETE
56,0.29653018861739044,2026-08-03 23:44:53.628768,2026-08-03 23:46:08.209435,0 days 00:01:14.580667,silu,512,0.4794239227365283,50,0.00017457997318617939,1,170,,,adamw,sgd,14,1.9180985780436432e-05,COMPLETE
57,0.3144154913344789,2026-08-03 23:46:08.213026,2026-08-03 23:48:38.656290,0 days 00:02:30.443264,silu,32,0.49589770236712,80,0.0004924784325668134,1,195,,,adamw,sgd,30,8.80540404306127e-05,COMPLETE
58,0.32024290884464496,2026-08-03 23:48:38.659137,2026-08-03 23:50:24.105641,0 days 00:01:45.446504,leaky_relu,128,0.480409922857792,122,0.00016214667061426304,1,183,,,adamw,sgd,39,1.0256517950877286e-05,COMPLETE
59,0.3292603933807425,2026-08-03 23:50:24.110019,2026-08-03 23:52:43.913839,0 days 00:02:19.803820,silu,32,0.49857221192416146,74,0.00011631829837139966,1,209,,,adamw,sgd,27,5.1721013991271454e-05,COMPLETE
60,0.32296256653068656,2026-08-03 23:52:43.918343,2026-08-03 23:55:34.914558,0 days 00:02:50.996215,silu,32,0.42691676162873965,102,0.0002962317078058558,1,169,,,adamw,sgd,40,1.750998044891306e-06,COMPLETE
61,0.3295450501287107,2026-08-03 23:55:34.918107,2026-08-03 23:57:47.207617,0 days 00:02:12.289510,silu,32,0.4360561073838502,64,0.00019670189381821866,1,204,,,adamw,adam,38,1.3519882582994939e-05,COMPLETE
62,0.3308901329222729,2026-08-03 23:57:47.210586,2026-08-04 00:00:27.854026,0 days 00:02:40.643440,silu,32,0.4422512534888767,96,0.00015733646447935914,1,139,,,adamw,adam,36,2.0934921754093405e-05,COMPLETE
63,0.32825768399371325,2026-08-04 00:00:27.858928,2026-08-04 00:03:24.210904,0 days 00:02:56.351976,silu,32,0.4744229013078713,122,0.00018779568489083595,1,183,,,adamw,adamw,38,3.6659924388456774e-05,COMPLETE
64,0.33279076542607966,2026-08-04 00:03:24.214774,2026-08-04 00:05:34.325502,0 days 00:02:10.110728,silu,32,0.44851400568139016,65,0.00010000636117181006,1,164,,,adamw,adam,32,7.8611989303575e-06,COMPLETE
65,0.3230249612961184,2026-08-04 00:05:34.329123,2026-08-04 00:07:25.492487,0 days 00:01:51.163364,silu,64,0.48353652162123656,90,0.0001123959051638057,1,160,,,adamw,adam,33,3.950474266442397e-06,COMPLETE
66,0.33199422543979096,2026-08-04 00:07:25.495543,2026-08-04 00:09:29.653208,0 days 00:02:04.157665,silu,32,0.4505023200993401,66,0.00010153917397531274,1,173,,,adamw,adam,35,7.5904879308237595e-06,COMPLETE
67,0.3105219688427553,2026-08-04 00:09:29.657650,2026-08-04 00:11:57.347436,0 days 00:02:27.689786,gelu,32,0.38914554622323455,117,0.0062125157926260065,1,212,,,adamw,adam,43,9.218895730998389e-06,COMPLETE
68,0.32346810812882654,2026-08-04 00:11:57.352166,2026-08-04 00:15:17.393331,0 days 00:03:20.041165,silu,32,0.42191759913736115,142,0.00015479985895524285,1,159,,,adamw,rmsprop,32,0.0018181402478694615,COMPLETE
69,0.33347206097299176,2026-08-04 00:15:17.398405,2026-08-04 00:17:28.954973,0 days 00:02:11.556568,silu,32,0.4728074213589625,62,0.000212185802005269,1,175,,,adamw,adam,40,1.4326832188862217e-05,COMPLETE
70,0.3125654531938309,2026-08-04 00:17:28.958729,2026-08-04 00:18:45.755240,0 days 00:01:16.796511,silu,256,0.4649484593150714,52,0.00041461637492372876,1,152,,,adamw,adamw,40,2.2193964877301483e-05,COMPLETE
71,0.3344543554708778,2026-08-04 00:18:45.758276,2026-08-04 00:21:03.369344,0 days 00:02:17.611068,silu,32,0.48239098133752767,70,0.00021423102804229112,1,175,,,adamw,adam,37,5.541375680508271e-06,COMPLETE
72,0.3251929362226346,2026-08-04 00:21:03.372547,2026-08-04 00:23:38.490771,0 days 00:02:35.118224,silu,32,0.4816028237854921,86,0.0002244219125717121,1,174,,,adamw,adam,37,1.333124951006328e-05,COMPLETE
73,0.3126179790601592,2026-08-04 00:23:38.495707,2026-08-04 00:27:07.234520,0 days 00:03:28.738813,silu,32,0.4915891283670599,141,0.00027480767591270093,1,188,,,adamw,adam,43,5.197647826563008e-06,COMPLETE
74,0.3232988585815663,2026-08-04 00:27:07.237664,2026-08-04 00:29:59.681071,0 days 00:02:52.443407,silu,32,0.46600354514929665,111,0.00021192291233307096,1,180,,,adamw,adam,39,2.5695431538457475e-05,COMPLETE
75,0.31252338635226895,2026-08-04 00:29:59.685921,2026-08-04 00:32:22.419396,0 days 00:02:22.733475,silu,32,0.42042079897885665,73,0.0012755410485045253,1,190,,,adamw,adam,41,4.4305362330820786e-05,COMPLETE
76,0.3333001540947527,2026-08-04 00:32:22.422835,2026-08-04 00:34:09.179033,0 days 00:01:46.756198,silu,32,0.4586652875482777,52,0.0031840786556664342,1,142,,,sgd,adam,37,6.153804631978117e-05,COMPLETE
77,0.3236177861836758,2026-08-04 00:34:09.182140,2026-08-04 00:35:41.764277,0 days 00:01:32.582137,gelu,64,0.49998094626191486,59,0.002869709914284648,1,140,,,sgd,sgd,36,5.667066243174531e-05,COMPLETE
78,0.3333378339037153,2026-08-04 00:35:41.767298,2026-08-04 00:37:43.217099,0 days 00:02:01.449801,silu,32,0.4542480558563515,83,0.00842451398393789,1,127,,,sgd,adam,37,0.0001761462115073378,COMPLETE
79,0.26188284684278285,2026-08-04 00:37:43.220328,2026-08-04 00:38:59.618950,0 days 00:01:16.398622,silu,512,0.4500116440499713,88,0.002219664618831223,1,126,,,sgd,adam,40,2.7812555022670903e-06,COMPLETE
80,0.3131706865892538,2026-08-04 00:38:59.622033,2026-08-04 00:40:19.314766,0 days 00:01:19.692733,leaky_relu,128,0.4657332218482239,102,0.0035860271537029326,1,146,,,sgd,adam,18,0.00039779085125549613,COMPLETE
81,0.33433600031770394,2026-08-04 00:40:19.317829,2026-08-04 00:42:04.601788,0 days 00:01:45.283959,silu,32,0.4767584457676118,51,0.007000097870333721,1,176,,,sgd,adam,35,0.00018940455597816341,COMPLETE
82,0.3362531291988521,2026-08-04 00:42:04.604931,2026-08-04 00:43:52.377282,0 days 00:01:47.772351,silu,32,0.43509780821796074,53,0.007374903769331466,1,178,,,sgd,adam,37,0.0001750650367668561,COMPLETE
83,0.3290872234047152,2026-08-04 00:43:52.380587,2026-08-04 00:45:49.796785,0 days 00:01:57.416198,silu,32,0.4377856604637715,80,0.009498263892179396,1,109,,,sgd,adam,35,0.0010982178294179725,COMPLETE
84,0.328484156495386,2026-08-04 00:45:49.799935,2026-08-04 00:48:03.876277,0 days 00:02:14.076342,silu,32,0.47210847974801584,131,0.007738788457029058,1,177,,,sgd,adam,39,0.0002805585505406666,COMPLETE
85,0.3296173858894188,2026-08-04 00:48:03.879668,2026-08-04 00:50:32.323259,0 days 00:02:28.443591,silu,32,0.48613963886201295,161,0.0057134391602989216,1,198,,,sgd,adam,41,0.00023139070698302206,COMPLETE
86,0.33253425867615255,2026-08-04 00:50:32.327514,2026-08-04 00:52:17.178330,0 days 00:01:44.850816,silu,32,0.4514810626103342,50,0.006595590849959144,1,166,,,sgd,adam,37,0.00017440414674094816,COMPLETE
87,0.3297890428948988,2026-08-04 00:52:17.182166,2026-08-04 00:54:32.237316,0 days 00:02:15.055150,silu,32,0.26351149479447655,95,0.004817649105501887,1,156,,,sgd,adam,44,0.0001111798250809963,COMPLETE
88,0.3346750181852398,2026-08-04 00:54:32.241790,2026-08-04 00:56:17.961551,0 days 00:01:45.719761,silu,32,0.41950760817862165,61,0.007267095835449637,1,225,,,sgd,adamw,34,0.0001953623584850389,COMPLETE
89,0.3287992542198571,2026-08-04 00:56:17.964848,2026-08-04 00:58:07.860558,0 days 00:01:49.895710,silu,32,0.4328156200514803,62,0.004441447570286723,1,202,,,sgd,adamw,23,0.00036971363872848024,COMPLETE
90,0.2959346386347171,2026-08-04 00:58:07.863838,2026-08-04 01:00:22.232576,0 days 00:02:14.368738,gelu,32,0.41539814441828893,74,0.005316161712283498,1,240,,,rmsprop,adamw,10,1.4273434883541322e-05,COMPLETE
91,0.33277434250527316,2026-08-04 01:00:22.236986,2026-08-04 01:02:28.892876,0 days 00:02:06.655890,silu,32,0.4733674272387039,80,0.007978686694591636,1,190,,,sgd,adamw,33,0.00018756949109384154,COMPLETE
92,0.335829534989445,2026-08-04 01:02:28.896574,2026-08-04 01:04:16.205240,0 days 00:01:47.308666,silu,32,0.4404783473624746,60,0.009993282860809541,1,215,,,sgd,adamw,35,0.00029711527705820323,COMPLETE
93,0.32989964631494617,2026-08-04 01:04:16.208675,2026-08-04 01:06:08.727651,0 days 00:01:52.518976,silu,32,0.4661116011784644,59,0.00962758757424568,1,220,,,sgd,adamw,35,0.0005572361227993611,COMPLETE
94,0.3331691977113853,2026-08-04 01:06:08.731195,2026-08-04 01:08:06.175552,0 days 00:01:57.444357,silu,32,0.1622643005107362,66,0.006797256431634779,1,235,,,sgd,adamw,39,0.00027735946031937693,COMPLETE
95,0.3325773160513564,2026-08-04 01:08:06.179845,2026-08-04 01:10:16.486302,0 days 00:02:10.306457,silu,32,0.3954308496085136,104,0.006699496789753264,1,179,,,sgd,adamw,34,0.0030173391317337367,COMPLETE
96,0.3096079381332994,2026-08-04 01:10:16.489976,2026-08-04 01:11:34.145230,0 days 00:01:17.655254,silu,256,0.4418649188041768,56,0.00901600641807858,1,215,,,sgd,adamw,38,7.376933846161428e-05,COMPLETE
97,0.30953714986806297,2026-08-04 01:11:34.148723,2026-08-04 01:14:04.545084,0 days 00:02:30.396361,silu,32,0.4888912641268715,93,0.007254162860160637,1,222,,,adamw,adamw,41,0.00022748727857629177,COMPLETE
98,0.3140182494477713,2026-08-04 01:14:04.548630,2026-08-04 01:15:22.826158,0 days 00:01:18.277528,leaky_relu,512,0.4259188829217891,73,0.005583650759969815,1,225,,,adamw,sgd,34,0.00012655973895290138,COMPLETE
99,0.299052124213802,2026-08-04 01:15:22.829782,2026-08-04 01:17:12.711762,0 days 00:01:49.881980,silu,64,0.37349412317534814,110,0.00025548231786252023,1,185,,,sgd,rmsprop,30,0.00040294365900645006,COMPLETE
